{
    "type": "spell_list_effect",
    "name": "",
    "description": "",
    "spells": [
        {"level": 1, "known": 4, "from": "_dnd5e:spell_lists.bard"},
        {"level": 2, "known": 5, "from": "_dnd5e:spell_lists.bard"},
        {"level": 3, "known": 6, "from": "_dnd5e:spell_lists.bard"},
        {"level": 4, "known": 7, "from": "_dnd5e:spell_lists.bard"},
        {"level": 5, "known": 8, "from": "_dnd5e:spell_lists.bard"},
        {"level": 6, "known": 9, "from": "_dnd5e:spell_lists.bard"},
        {"level": 7, "known": 8, "from": "_dnd5e:spell_lists.bard"},
        {"level": 8, "known": 9, "from": "_dnd5e:spell_lists.bard"},
        {"level": 9, "known": 10, "from": "_dnd5e:spell_lists.bard"},
        {"level": 10, "known": 12, "from": "_dnd5e:spell_lists.bard"},
        {"level": 11, "known": 13, "from": "_dnd5e:spell_lists.bard"},
        {"level": 12, "known": 13, "from": "_dnd5e:spell_lists.bard"},
        {"level": 13, "known": 14, "from": "_dnd5e:spell_lists.bard"},
        {"level": 14, "known": 14, "from": "_dnd5e:spell_lists.bard"},
        {"level": 15, "known": 15, "from": "_dnd5e:spell_lists.bard"},
        {"level": 16, "known": 15, "from": "_dnd5e:spell_lists.bard"},
        {"level": 17, "known": 16, "from": "_dnd5e:spell_lists.bard"},
        {"start_level": 18, "known": 16, "from": "_dnd5e:spell_lists.bard"}
    ]
}